0,Fecha,Hora,Usuario,Nota Técnica
5105,12/22/2022,14:2:52,Soldier,"se lo llevo y prometio restaurarlo de cero por que podria ser un problema de soft el equipo seguia con el problema de que se apagaba"
5112,12/15/2022,15:41:33,lolo,"fue a otro servicio tecnico antes tiene escrito un blindaje y pregado estampitas en la parte de atras de la pantalla tiene mala la panta(no anda se ve todo blanco y negro esta rota) y su bate está inchadisima puse otra bate y otra panta y le funciona todo ok(el boton y el flex frontal ok también) presupuestar cambio de panta y de bate"
5112,12/20/2022,14:14:40,Jeibito,PERANDO RTA
5112,12/20/2022,16:21:32,Jeibito,confirmado panta genrrica y b ate en 21k
5112,12/21/2022,10:55:38,lolo,este equipo ya está hecho? no lo encuentro acá arriba
5112,12/21/2022,10:55:46,lolo,(ricky)
5112,12/21/2022,11:39:13,Jeibito,tiene que estar arriba pa
5112,12/21/2022,13:16:28,Ricky,"cambios hechos funciona todo ok no aparece la condicion de la bate creo que antes no aparecia tampoco no estoy seguro todo el resto ok"
5113,12/20/2022,10:46:28,nico,"tiene las placas despegadas no toma señal ni wifi ni bluetooth ver cuanto se le pasa a obelisco"
5113,12/20/2022,11:25:53,Soldier,le voy a pasar $105.000
5113,12/20/2022,11:48:52,Soldier,"presupuesto aprobado el cliente sabe que puede morir"
5113,12/21/2022,21:30:27,Señor Rafa,"se hizo poronga jajaja què hacemos? lo devolvemos así? o compramos otro por 600usd. Aguardo respuesta."
5113,1/4/2023,9:29:57,Soldier,"ya le tire la mala noticia al cliente hay que conseguir un equipo para venderle o una placa con face id para hacerle swap"
5113,1/4/2023,9:30:25,Soldier,la idea es que el chabon no pague lo mismo que vale un equipo 0km
5113,1/4/2023,13:23:22,nico,"no se porq esta aca suerteeeeeee"
5115,12/19/2022,9:56:55,lolo,"carga en 03 con varias su bate y otras más medí el ic de caga y carga en 08 con varios pines de carga tiene ic de carga la reparación cuesta más que el celular pasar lista de precios de celulares para la venta"
5115,12/21/2022,9:38:30,Soldier,ingresa al obelisco para retirar.
5116,12/16/2022,9:25:24,Ricky,"probé el celular antes de hacerle nada y no le andaba la huella todo el resto ok probé con otro pin de carga y cargó bien presupuestar cambio de pin de carga"
5116,12/16/2022,9:39:33,Jeibito,confirmado cambio de pin $7500.-
5116,12/16/2022,11:1:10,Ricky,"ya le cambie el pin de carga y funciona bien pero parece que hace falso contacto ahora el parlante me falta revisar eso"
5116,12/16/2022,11:47:18,Ricky,"ya arregle el falso contacto funciona todo ok"
5116,12/16/2022,11:55:19,Jeibito,GRANDE RICKY
5117,12/19/2022,10:4:2,nico,"presupuestar cambio de panta todo el resto ok"
5117,12/22/2022,13:21:38,Soldier,ok para cambio de pantalla original presupuesto aprobado $79700.-
5117,12/22/2022,13:41:8,nico,ya esta armado para llevar a apple
5118,12/16/2022,13:13:20,Ricky,"el telefono está en loop hay que restaurarlo porque puede ser software no es ninguno de los perifericos"
5118,12/22/2022,13:22:15,Soldier,"ok para restaurar presupuesto aprobado $6000.-"
5118,12/22/2022,15:15:27,Ricky,"lo intento restaurar y me tira error 4013 es un problema de nandflash tiene que pasar por microsoldadura y puede salir o no"
5118,12/23/2022,9:13:34,nico,"tiene microsoldadura por nandflash ademas del problema de wifi q no lo pudimos ver es mas caro el arreglo q un telefono nuevo pasar lista de precios"
5123,12/20/2022,10:10:47,lolo,"le robaron el blindaje de la batería le pusieron stickers pero no parece que le hayan heccho algo. Presupuestar cambio de batería la suya no funciona con otra batería todo funciona ok."
5123,12/20/2022,10:11:1,lolo,No tiene consumo
5123,12/20/2022,10:15:25,lolo,"tiene hecho el ic de audio nada más"
5123,12/21/2022,16:10:48,Soldier,okpara el cambio de bate
5123,12/22/2022,10:16:34,Ricky,cambio de batee hecho funciona todo ok
5123,12/23/2022,13:44:51,Soldier,Equipo listo para retirar.
5127,12/20/2022,9:52:39,lolo,pedir contraseña para probar el celular (ricky)
5127,12/20/2022,9:56:46,lolo,"hay un flexible que lo pone en loop pero no sabemos cual es todavía necesito la contra(ricky)"
5127,12/21/2022,16:4:42,Soldier,no lo hace!
5127,12/22/2022,9:8:11,nico,cerrado
5128,12/20/2022,9:27:0,nico,"esta en recoverey hay q restaurarlo  avisar al cliente esta muy manoseado le faltan todos los blindajes pedir apple id y contraseña tambien la contraseña del telefono"
5128,12/20/2022,13:8:43,Soldier,"pelael87@gmail.con Funpeople1"
5128,12/21/2022,10:3:9,Ricky,"restaura bien pero cuando se reinicia se vuelve a poner en recovery lo conecté a la fuente y no reacciona se queda en 0 todo el tiempo"
5128,12/21/2022,10:40:40,lolo,"le puse otra batería y pasa lo mismo sigue en recovery"
5128,12/21/2022,11:53:37,lolo,"lo del tactil puede ser por que está muy mal el conector del tactil pero está muy tocado el celular teiene un monton de problemas no sale del recovery por ahí si se arregla el tactil igual termine teniendo otros problemas pasar precio de celulares usados"
5128,12/21/2022,15:46:14,Soldier,"no sale avisar al cliente que sale irreparable y venderle un equipo"
5128,12/21/2022,16:5:32,Soldier,cerrar no lo hace
5128,12/22/2022,9:11:13,nico,cerrado
5129,12/20/2022,9:13:44,nico,"el flex frontal lo pone en loop antes de presupuestar pedir contraseña para terminar de probarlo"
5129,12/20/2022,14:5:50,Soldier,contraseña 071004
5129,12/21/2022,11:12:6,lolo,"tiene la pantalla quebrada le funciona todo bien no podemos saber si le anda el flex frontal porque es lo que lo pone en loop(por ende no sabemos si le anda el face idel sensor de proximidadel parlante y el microfono) presupuestar microsoldadura de flex frontal"
5129,12/21/2022,16:6:4,Soldier,cerrar no lo hace
5129,12/22/2022,9:7:5,nico,cerrado
5130,12/16/2022,15:55:55,lolo,ya se cambió la bate´ria y la pantalla con True Tone.
5130,12/16/2022,15:56:3,lolo,"no tenía consumo ya se entregó"
5135,12/22/2022,13:54:22,Soldier,equipo en apple para hacer cambio debate
5135,12/23/2022,13:37:19,Soldier,El lciente retiró el equipo. abonó con transferencia.
5139,12/19/2022,12:46:9,lolo,"porqué en loop?? lo vieron dar imagen?? Carga en 0.1 y calienta no hace nada más. Tiene que estar mojado adentro. Si lo vieron prender que se lo lleve porque aca no prendió sino avisar al cliente que hay que abrirlo para saber donde está el problema."
5139,12/19/2022,17:29:50,Jeibito,"TRANQUI ESUVO EN LOOP Y AHORA NO ENCIENDE DIRECTSMENTE RELAX!"
5139,12/20/2022,14:30:52,Jeibito,ES AMIGA DE RAFA
5139,12/21/2022,13:1:7,lolo,"Según el jefe no es amiga suya. Avisar al ciente que hay que abrirlo y el riesgo que conlleva blablabla"
5139,12/22/2022,11:40:18,Jeibito,PERANDO RTA
5139,12/22/2022,13:47:46,Jeibito,ABRIME BB
5139,12/22/2022,15:15:11,lolo,se lo paso al jefe para que lo abra
5139,1/6/2023,15:43:48,lolo,"se está intentado comprar por 10k se pudo abrir bien pero está mojado"
5143,12/20/2022,9:2:26,nico,"avisar al cliente q hay q restaurar pedir apple id y contraseña tambien la contraseña del telefono"
5143,12/20/2022,14:36:24,Soldier,"ok para restaurar haganlo igual si llega a pedir apple id me avisan porque el cliente no continuaria con la reparacion"
5143,12/20/2022,15:23:22,Soldier,"restauro ok probarlo bien"
5143,12/20/2022,15:33:27,Ricky,"batería al 78% y tiene ic de audio probé las llamadas y y el sensor del flex frontal está no detecta (ahora veo si está mal acomodado o qué pero no detectó mi mano)"
5143,12/20/2022,15:43:59,Ricky,"el sensor no funciona por el ic de audio el cliente no va a hacer la reparación ahora se lo lleva con ic de audio y bate al 78% se lo lleva solo restaurado y paga 5k"
5143,12/21/2022,9:40:37,Soldier,Listo en el obelisco para retirar.
5143,12/22/2022,20:48:38,Soldier,entregado
5146,12/23/2022,10:59:37,lolo,"cambio hecho funciona todo ok"
5146,12/23/2022,13:43:21,Soldier,Equipo listo para retirar.
5149,12/19/2022,18:34:50,Marce Scana,DEJA REPUESTO PARA LA TECLA Y CARGADOR.
5149,12/20/2022,9:50:28,lolo,"?? presupuestar cambio de teclado no le funciona la mitad del teclado. El teclado en ML está $40k preguntarle a Fer cuanto está el teclado es en ingles"
5149,12/22/2022,14:48:42,Soldier,mañana se compra el teclado hay que darle prioridad
5149,12/23/2022,19:1:43,lolo,"ya ese le cambió el tecaldo el teclado funciona pero no le pude prbar m+as nada ´prqie lleg+o el cliente. PONGAN EL PRECIO QUE VINO A BELGRANO Y NO SABÍAMOS CUANTO ERA"
5153,12/20/2022,11:25:2,lolo,"está mal la contraseña pedir para poder probar"
5153,12/20/2022,16:31:31,Jeibito,perando rta
5153,12/20/2022,17:53:20,Jeibito,ver Scaglia1117 o Scaglia1711
5153,12/20/2022,17:53:33,Jeibito,con minuscula
5153,12/21/2022,11:47:54,lolo,"está re contra manoseado. Tenía todos los tornillos marcados y uno recontra falseado cuando la pudimos abrir vimos que tenía 2 tuercas de tornillos arrancadas el disco está mojado y la placa también. Cualquier intervención que se le haga a la computadora se puede terminar de romper otra cosa o no prender más. Tiene el teclado mojado y es como que se mantiene siempre apretada la tecla control por eso hay veces que no le funciona el teclado. Pero no podemos saber si es la placa o el mismo"
5153,12/21/2022,11:49:2,lolo,"teclado sin abrirla pero si se abre se puede terminar e romper algo su pantalla está moajada y se puede quedar sin imagen. Avisar al cleinte para que asuma el riesgo de que la revisemos completa sacando la placa para saber hasta donde llegó la u¿humedad sino la cerramos y que el garrón se lo coma en otro service"
5153,12/22/2022,10:15:53,Jeibito,PERANDO RTA
5153,12/22/2022,11:36:26,Jeibito,DENLE PALANTE
5153,12/22/2022,11:36:35,Jeibito,ABRIME B
5153,1/2/2023,9:26:11,Ricky,"presupuestar cambio de teclado. 30K Ahora solamente funciona la tecla 2 no pude probar ni me acuerdo que cosas le funcionaban yo creo que tendría que estar todo más o meos bien pero avisar al cliente y que tome la desición."
5153,1/2/2023,12:10:49,Jeibito,PERANDO RTA
5153,1/2/2023,12:43:3,Jeibito,CONFIRMADO CAMBIO DE TECLADO 30K
5153,1/2/2023,12:48:42,lolo,"se lo mando al jefe para que lo compre comprar teclado a1502 en español"
5153,1/4/2023,11:21:18,Señor Rafa,pedido
5153,1/5/2023,13:59:18,lolo,"ya está cambiado el teclado el suyo ya lo habían cambiado y como el culo. Ya está todo funcionando okardo"
5153,1/5/2023,13:59:20,lolo,entregar
5165,12/22/2022,13:55:59,Soldier,se le cambio la bateria y se le limpio a fondo el pin de carga que estaba muy sucio
5166,12/22/2022,13:57:24,Soldier,"se le cambio la pantalla por una refurbishedla bateri y el templado"
5168,12/22/2022,10:43:19,nico,"preguntar si se puede restaurar para descartar el tema q sea soft"
5168,12/22/2022,10:44:3,nico,"puede ser q tenga las placas despegadas pero primero descartemos lo de soft"
5175,12/23/2022,10:7:19,nico,"tenia desconectada la bateria ya prendio la contraseña es de 6 digitos no 4 pedir contraseña"
5175,12/23/2022,10:21:52,Soldier,270875
5175,12/23/2022,11:23:42,nico,"la bateria estaba desconectada todo el resto esta ok la bateria es generica y esta 83% ver si le quieren cobrar cambio de bate o otra cosa"
5175,12/23/2022,12:1:59,Soldier,ok para conectar la bateria $9500 y para cambio de bate $9400
5175,12/23/2022,13:44:11,Soldier,Equipo listo para retirar.
5176,12/22/2022,10:9:33,nico,pedir contraseña para probar
5176,12/22/2022,13:59:55,Soldier,424968
5176,12/22/2022,15:34:47,nico,"Preguntar si se puede restablecer la configuracion del telefono probe con otro vibrador y hace lo mismo calculo q se puede porq no pierde la info pero por las dudas"
5176,1/3/2023,14:54:4,Soldier,"se lo lleva como esta armarlo"
5176,1/4/2023,9:6:15,nico,armado
5178,12/23/2022,10:1:54,nico,"tiene el flex frontal mojado lo q hace q el telefono entre en loop. presupuestar microsoldadura fff 35k los sensores de humedad estan bien no estan en rojo"
5178,12/23/2022,10:2:4,nico,mando foto al telefono del obe
5178,12/23/2022,10:3:56,nico,"puede ser q el face id se arregle o no avisar al cliente lo que seguro se arregla es lo de las llamadas"
5178,12/23/2022,10:4:45,nico,"calculo q se va a arreglar el face id porq la camara true depth no esta fea pero no podemos saber %100"
5178,12/23/2022,12:17:32,Soldier,"ok para reparar el face id $35000.-"
5178,12/23/2022,12:36:17,Señor Rafa,"quedo sin face id está mal la true depth."
5178,12/23/2022,14:36:28,nico,presupuestar camara true depth o lo cierro asi???
5178,12/23/2022,15:1:33,Soldier,"ok para FF y camara true depth por 12k mas total 47k y retira en enero"
5178,1/2/2023,9:7:22,nico,este equipo esta aca o en obe??
5179,1/3/2023,11:38:19,lolo,"la verdad que no se como Obelisco no cierra con tantos idiotas. Vamos a empezar desde el principio: La macbook es una A1708 espero que tu empleador no haya preguntado si conseguiamos pantalla de 1278 por esta orden. Después no me iba a enterar nunca que esa computadora estaba en Belgrano si no la asignan. Y ahora como repuesta a la orden en cuestión hay que cambiar la pantalla ahora tenemos lcd así que se puede pasar 2 precios. Por cambio de pantalla completa que hay que comprar o por cambio"
5179,1/3/2023,11:38:46,lolo,de display únicamente que tienen que preguntarle a Agus cuanto se presupuesta y si tiene repuesto para ese modelo
5179,1/3/2023,12:24:4,lolo,"cambio solo cristal liquido $85k cambio de panta original nueva 140k cambio por pantalla original usada"
5179,1/3/2023,15:51:45,nico,que precio??
5179,1/3/2023,15:51:53,nico,comprar
5179,1/4/2023,9:14:6,lolo,"tienen que hablar con el jefe a ver ccomo es el tema si tienen que comprar una macbook rota o él tiene proveedor y poner el precio de cuanot le pasaron. Que siempre quede anotado en SatWeb"
5179,1/4/2023,9:52:30,Soldier,ok para cambio de panta por original
5179,1/4/2023,10:20:36,Soldier,"esta pedida la pantalla cuando llegue hagan el cambio tiene que ser para antes del viernes"
5179,1/5/2023,10:16:18,lolo,"ya está hecho el cambio e pantalla es de otro color. Las teclas tenes que apretarlas para que funcionen si apretas despacio capaz no se toca. Después el sistema operativo es sierra. Re contra antinguo recomendamos la actualización a Monterrey si quiere se lo podemos actualizar pero es muy probable que algunas aplicaciones que tenga actualmente empiecen a ser incompatibles. Entocnes si lo quiere acutalizar que nos diga que aplicaciones querría que le descarguemos. Todo el resto ok"
5182,12/23/2022,11:25:46,lolo,"necesito la contraseña así pruebo el telefono si que mas tiene y que no lo conecté otra panta y prendió normal se apaga sola y deja de cargar pero tiene bien el ic de carga"
5182,12/23/2022,12:0:58,Ricky,"el tema de que se reinicia se resolvio con otra bate presupuestar cambio de pantalla y cambio de bate puede tener algo más pero no probé el celular espero la contraseña y así veo que le hicieron en el otro servicio tecnico con lo del problema de audio"
5182,1/3/2023,16:0:33,Soldier,pass 3266
5182,1/4/2023,15:31:34,nico,"es de 6 digitos la contraseña no de 4"
5186,1/3/2023,12:19:45,lolo,"tiene mojada la parte inferior de la motherboard hay que reparar 4 lineas presupuestar $40k se reinicia normalmente y cuando prende no tiene audio. Todo el resto funciona"
5186,1/3/2023,14:26:32,Jeibito,PORFA MANDENME FOTO DE LA ORDEN AL GRUPO
5186,1/3/2023,14:45:39,lolo,done
5186,1/3/2023,15:59:48,Jeibito,PERANDO RTA
5188,1/2/2023,9:38:48,Ricky,"pedir bien la contaseña no es: 1234 1234-MART 1234 - MART 1234-mart 1234 - mart mart"
5188,1/2/2023,10:24:19,Jeibito,Y MART?
5188,1/2/2023,10:25:22,Jeibito,Mart?
5188,1/2/2023,14:41:10,lolo,no es ninguna de esas tampoco
5189,12/23/2022,15:46:20,Ricky,"el celular carga en 0 midiendole el ic de carga con varios pines iba variando los valores entre 0.4 y 1 presupuestar ic de carga"
5189,12/23/2022,15:46:54,Ricky,puede tener algo más pero como no prendió no lo pude probar todavía
5189,1/2/2023,10:37:26,Soldier,ok para hacer ic de carga $19000.- lo busca mañana
5189,1/2/2023,12:34:31,lolo,lo dejo desarmado para que se haga la microsoldadura
5189,1/5/2023,10:48:17,lolo,"microsoldadura hecha el celular estaba en loop le conecté solo lo principal y prendió pedir contraseña para probar"
5189,1/9/2023,11:6:8,facundo,pass: 040819
5189,1/9/2023,12:50:17,lolo,"ya encendió su flexible frontal lo pone en loop presupuestar cambio de flexible frontal su botón home no funciona el click ni la huella el problema está en el flexible de la pantalla presupuestar cambio de flex de botón. Todo el resto funciona bienbatería 100% es génerica"
5196,1/2/2023,14:20:51,lolo,"presupuestar microsoldadura de reparación de carga $25.000. Después su batería está hinchada ya la tuvo que ver el chabón cuando la sacó y la volvió a poner. Averiguar y si quiere también presupuestar cambio de batería. Todo el resto ok"
5196,1/2/2023,14:24:40,lolo,en los 25k le incluimos la limpieza que está toda sucia
5196,1/3/2023,14:29:4,Jeibito,QUE SERIA ¨REPARACION DE CARGA¨???
5196,1/3/2023,14:29:36,Jeibito,LA BATERÍA CUANTO $$$$
5196,1/3/2023,14:29:52,Jeibito,NO SÉ CUAL ES MAC ES
5196,1/3/2023,14:48:29,lolo,"es una macbook a1278 la batería sale una fortuna. Preguntarle all jefe La reparación de carga es microsoldadura en el circuito de carga unas resistencias se cambian de valor"
5196,1/3/2023,16:53:32,Jeibito,ESTA USABLE LA BATA?? PUEDE ARREGLARLE LA PLACA Y SEGUIR USANDO ESA BATE??
5196,1/4/2023,9:12:24,lolo,"sisis por ahora su batería funciona y toma carga la dejo todo el día cargando a ver si llega al 100% y cuanto tarda en descargarse pero ya podes avisarle al cliente que la batería todavía la puede seguir usando"
5196,1/4/2023,14:6:34,lolo,se le baja rápido la batería pasa de 100% a 81% pero 1hs debe aguantarle
5196,1/4/2023,18:58:16,Jeibito,perando rta
5199,1/2/2023,12:47:30,lolo,"está mojada adentro tiene mojado el integrado U1900. Presupuestar microsoldadura por $45.000 no sabemos si tiene más cosas mal"
5199,1/3/2023,14:36:49,Jeibito,PERANDO RTA
5199,1/3/2023,16:33:29,Jeibito,CONFIRMADO
5199,1/5/2023,17:31:52,Jeibito,YYY
5199,1/6/2023,9:43:26,lolo,estaba mojada pero no pudimos encontrar donde está el problema. Sabemos que está en la linea PM_SLP_S4_L que controla la activación de los circuitos de S4 pero al ser un clock no tenemos un osciloscopio para poder ver si la señal está siendo enviada o el problema se encuentra en otro lado. Devolver
5199,1/9/2023,15:55:35,Jeibito,preupuestar respaldo de la info del disco
5204,1/2/2023,15:38:53,lolo,FACUNDO NO ME LA ASIGNES A MI SOLOOO y asignen las cosas cuando las traigan a Belgrano
5204,1/3/2023,11:5:14,lolo,"tiene mojado el trackpad presupuestar microsoldadura de reparación de trackpad. Preguntar a Agus cuanto se le pasa. Ya está reparado y le funciona todo"
5204,1/3/2023,11:12:1,lolo,"presupuestar $38.000 de reparación con todo funcionando o $25.000 sin trackpad tendría que usarlo con mouse conectado"
5204,1/3/2023,15:28:7,Soldier,55k con todo funcionando o 39k sin trackpad
5204,1/4/2023,12:23:46,Soldier,"ok para reparar todo!!!! que le quede rica rica"
5204,1/4/2023,12:48:0,lolo,"ya quedó funcionando bine lab batería está en 974 ciclos pero funciona normal y el disco es de 128gb y ya tiene 120gb ocupados tiene que borrar cosas e intentar actualizarla a la úlima versión para que le ande rápido y bine. Entreagr o avisar esto al cliente capaz quiere que se la formatemos nosotros y se la actualicemos"
5204,1/6/2023,11:45:57,facundo,Perfecto no formaterar! Gracias miuchachos
5204,1/6/2023,13:24:43,lolo,creo que ya se la llevó el soldier. Entregar
5205,1/3/2023,13:0:31,lolo,"presupuestar corto en vcc main puede tener algo más pero no se pudo probar todavía"
5205,1/4/2023,14:11:29,Soldier,Lo hace la proxima semana
5205,1/4/2023,17:21:44,Soldier,ok para el corto vcc a 25k
5205,1/5/2023,9:58:43,lolo,se lo dejo desarmado a jefe (ricky)
5205,1/5/2023,12:7:39,lolo,"el jefe ya hizo el corto da imagen pero está en loop ya probe con otra batería y con todo desconectado y en la fuente y sigue en loop hay que restaurarlo avisar al cliente"
5205,1/5/2023,13:23:19,facundo,Dio el Okey para la restauración. Mándenle.
5205,1/9/2023,9:24:45,Señor Rafa,medir ic de carga.
5205,1/9/2023,10:5:7,Ricky,"el ic de carga mide bienno sale"
5205,1/9/2023,13:31:59,facundo,CERRAR
5208,1/2/2023,15:55:17,lolo,"presupuestar microsoldadura por $40k está mojada hay que cambiar el conector de la pantalla y los componentes cercanos. Adjunté video a wpp. No se si el resto de cosas funcionan o no"
5208,1/2/2023,15:59:10,Jeibito,"OK QUE ONDA EL PIN? EL QUE TIENE SUELTO ERA EL DE ELLA Y SE LO CAMBIÓ UN ANIMLITO..."
5208,1/3/2023,9:50:24,lolo,"o la compró usada o le dieron otro pin o ya es la 2da vez que cambia el pin. Porque el que está suelto es génerico pero no parece estar mal. Por?"
5208,1/3/2023,9:50:32,lolo,Ninguno de los 2 parece feo
5208,1/3/2023,16:50:11,Jeibito,PERANDO RTA
5208,1/3/2023,17:37:57,Jeibito,CONFIRMADO MICRO
5208,1/6/2023,10:35:21,lolo,"te comento ya se hizo prender. Le funciona todo como el culo. El teclado no le funcionan las teclas: 6y¿- esas 4. Después la pantalla se e verde y no se si el problema está en la pantalla o en la GPU y después su disco funciona mal no se si por la información o por el disco con otro disco funciona bien. Que se puede hacer que use un teclado externo porque la ""y"" y el ""6"" son teclas utiles su disco preguntar si se puede restaurar para saber si se salva el disco o hay que cambiarlo y la panta"
5208,1/6/2023,10:35:59,lolo,"la va a tener que usar así verde te mando foto. Queres cobrar algo es mucha mosca. Intenta que nos de dinero o que nos regale la compu idk"
5208,1/6/2023,10:36:34,lolo,"casi me olvido además su batería está mala solamente sirve para que prenda la compu no almacena carga. Terrible pija de compu"
5208,1/9/2023,14:57:47,Jeibito,PERANDO RTA
5208,1/9/2023,16:0:20,Jeibito,imposible acceder a la info? se puede hacer alo al respecto o si o si hay que formatearlo???
5209,1/3/2023,10:12:54,lolo,"presupuestar ic de carga no se si sus baterías funcionan pero pasalo a un lindo precio por haberlo intentado hacer solo. Además le falta el tornillo de la batería se lo regalamos con el precio de la microsoldadura"
5209,1/3/2023,17:56:9,Jeibito,PERANDO RTA
5210,1/3/2023,9:46:52,lolo,la pantalla se pone en verde cuando recién prende y después se queda completamente negra. Muy probablemente sea cambio de pantalla pero primero tendríamos que abrirlo por las dudas ya que no parece haber recibido un golpe. Avisar al cliente los riesgos de abrirlo y que se haga cargo y después le pasamos el presupuesto si es cambio de pantalla
5210,1/3/2023,17:58:36,Jeibito,PERANDO RTA
5215,1/3/2023,11:40:22,lolo,"decile que la próxima vez no se lleve la playa de Mar del Plata de recuerdo. Adentro está mojado y lleno de arena no sale devolver"
5216,1/3/2023,11:16:31,nico,"tiene un problema en el integrado de wifi es microsoldadura es una reparacion muy complicada avisar q puede no prender mas. pasar un presupuesto un poco mas caro que la mitad de un xs max"
5216,1/3/2023,16:4:48,Jeibito,PERANDO RTA RAFA
5216,1/4/2023,12:14:21,Jeibito,DESISTE ARMAR
5216,1/4/2023,13:22:4,lolo,"ya está armado netregar."
5218,1/3/2023,10:37:56,nico,"esta en loop hay q restaurarlo avisarle al cliente desp de eso hay q ver q mas tiene"
5218,1/4/2023,9:46:34,Soldier,"el telefono del cliente es 1122431459 mandarle un whatsapp contandole lo que te pase ayer"
5218,1/4/2023,17:21:21,Soldier,Dio el ok para hacer la restauracion. revisar si tiene algun otro defecto
5218,1/6/2023,10:42:0,nico,"no sale esta muy manoseado y tiene muchas fallas tiene problemas de nand tambien aparte de todos los otros problemas"
5218,1/9/2023,10:20:18,facundo,ok cerrar.
5220,1/3/2023,10:16:38,lolo,"el celular carga en 042 con varios pines de carga y con varias baterias pero tiene bien el ic de carga lo conecté en la fuente y tenía consumo apagado de 0.14 y no prendía presupuestar consumo apagado y puede tener algo mas pero no se pudo probar así no se sabe le faltaba un tornillo en uno de los blindajes y para mi se ve fea la placa (ricky)"
5220,1/3/2023,14:39:13,Jeibito,PERANDO RTA
5220,1/3/2023,15:34:14,Jeibito,LE OFRECEMOS CAMBIO DE PLACA? CUANTO $$$ FUNCA LA QUE EST'A ARRIBA??? DE CUANTOS GB ES???
5220,1/4/2023,9:22:44,lolo,"el 6sp de venta que está acá arriba es de 64 y el del cliente es de 128"
5220,1/4/2023,9:23:40,lolo,despues cuando venga agus le pregunto si cuanto se le puede cobrar y eso
5220,1/4/2023,9:34:24,lolo,"cuando saqué la placa para ver de cuanto era su memoria vi que estaba tocado su celular le faltaba las tapas negras de la parte de abajo"
5220,1/4/2023,10:37:52,Jeibito,CONFIRMADO MICRO 17K
5220,1/5/2023,9:33:30,lolo,"decirle al cliente que lo revisamos otra vez cuando lo desarmamos para ver si le haciamos la microsoldadura pero que tiene un monton de problemas más tiene la pantalla mala está muy feo no sale tal vez podemos hacer que prenda pero que tenga muchos problema as posteriores y repararlo al 100 costaría lo mismo que 2 6sp preguntarle si lo que quiere es recuperar informacio que le podemos pasar presupuesto para ello y llisto.(ricky)"
5220,1/5/2023,10:39:30,Jeibito,PERANDO RTA
5220,1/5/2023,11:28:2,Jeibito,ADJUNTO IPHONE 8 ROSE SIM 55785 PARA PASAR LA INFO DEL 6P A ÉSTE
5220,1/5/2023,11:28:54,Jeibito,478383 PASS DEL 8
5220,1/5/2023,11:29:6,Jeibito,CUANTO$$$
5220,1/5/2023,11:50:40,nico,8k
5220,1/5/2023,11:51:17,nico,ver si el 8 tiene el mismo espacio q el 6sp o mas
5220,1/6/2023,9:36:7,Jeibito,perando rta
5220,1/6/2023,12:48:39,lolo,"el presupuesto pasado anteriormente es erróneo para poder hacer el traspaso de información primero tiene que prender el equipo y en este caso no prende por eso el costo del mismo es mas caro pasar 25k"
5220,1/6/2023,15:58:2,Jeibito,CONFIRMADO 25K TRASLADO DE LA INFO AL 8
5220,1/9/2023,9:8:42,Ricky,se lo dejo desarmado al jefe para ver el consumo apagado
